{
  "analysisContext": {
    "files": [
      {
        "name": "package.json",
        "content": "{\n  \"name\": \"code-helper\",\n  \"version\": \"1.0.0\",\n  \"description\": \"CLI tool for code assistance\",\n  \"main\": \"dist/cli/index.js\",\n  \"bin\": {\n    \"code-help\": \"dist/cli/index.js\"\n  },\n  \"scripts\": {\n    \"build\": \"tsc && npm link\",\n    \"start\": \"node dist/cli/index.js\",\n    \"dev\": \"ts-node src/cli/index.ts\"\n  },\n  \"dependencies\": {\n    \"@ast-grep/cli\": \"^0.33.1\",\n    \"axios\": \"^1.7.9\",\n    \"chalk\": \"^5.4.1\",\n    \"commander\": \"^11.1.0\",\n    \"glob\": \"^11.0.1\",\n    \"inquirer\": \"^9.3.7\"\n  },\n  \"devDependencies\": {\n    \"@types/glob\": \"^8.1.0\",\n    \"@types/inquirer\": \"^9.0.7\",\n    \"@types/node\": \"^20.17.12\",\n    \"ts-node\": \"^10.9.2\",\n    \"typescript\": \"^5.7.3\"\n  },\n  \"keywords\": [],\n  \"author\": \"\",\n  \"license\": \"ISC\",\n  \"type\": \"commonjs\"\n}\n"
      }
    ],
    "errorLog": "AxiosError: Request failed with status code 503\n    at settle (/home/rdksupe/debug-terminal/node_modules/axios/dist/node/axios.cjs:2026:12)\n    at IncomingMessage.handleStreamEnd (/home/rdksupe/debug-terminal/node_modules/axios/dist/node/axios.cjs:3142:11)\n    at IncomingMessage.emit (node:events:525:35)\n    at endReadableNT (node:internal/streams/readable:1696:12)\n    at process.processTicksAndRejections (node:internal/process/task_queues:90:21)\n    at Axios.request (/home/rdksupe/debug-terminal/node_modules/axios/dist/node/axios.cjs:4252:41)\n    at process.processTicksAndRejections (node:internal/process/task_queues:105:5)\n    at async sendToLLM (/home/rdksupe/debug-terminal/dist/cli/index.js:307:26)\n    at async Command.<anonymous> (/home/rdksupe/debug-terminal/dist/cli/index.js:575:34) {\n",
    "projectContext": "\n# Project and Environment Context\nGenerated at: 2025-01-19T19:27:55.183Z\n\n## System Information\n- Platform: linux\n- Architecture: x64\n- Node Version: v23.3.0\n- CPU Cores: 12\n- Memory: 15GB total, 5GB free\n\n## Project Information\n- Project Path: /home/rdksupe/debug-terminal\n\n- Name: code-helper\n- Version: 1.0.0\n- Description: CLI tool for code assistance\n\n\n## Git Information\n\n- Current Branch: main\n- Latest Commit: null\n- Remote URL: null\n- Status: ?? .gitignore\n?? llm-context-2025-01-19T18-16-29-086Z.json\n?? llm-context-2025-01-19T18-19-12-166Z.json\n?? llm-context-2025-01-19T18-19-49-091Z.json\n?? llm-context-2025-01-19T18-30-26-480Z.json\n?? llm-context-2025-01-19T19-22-21-512Z.json\n?? llm-context-2025-01-19T19-25-38-584Z.json\n?? package.json\n?? src/\n?? tsconfig.json\n\n\n## Project Structure\n```\n├── dist\n    ├── cli\n    │   └── index.js\n    └── utils\n    │   ├── ProjectContextGatherer.js\n    │   ├── apiUtils.js\n    │   ├── displayUtils.js\n    │   ├── fileUtils.js\n    │   ├── stackTraceParser.js\n    │   └── types.js\n├── llm-context-2025-01-19T18-16-29-086Z.json\n├── llm-context-2025-01-19T18-19-12-166Z.json\n├── llm-context-2025-01-19T18-19-49-091Z.json\n├── llm-context-2025-01-19T18-30-26-480Z.json\n├── llm-context-2025-01-19T19-22-21-512Z.json\n├── llm-context-2025-01-19T19-25-38-584Z.json\n├── package-lock.json\n├── package.json\n├── src\n    ├── cli\n    │   └── index.ts\n    └── utils\n    │   ├── ProjectContextGatherer.ts\n    │   ├── apiUtils.ts\n    │   ├── displayUtils.ts\n    │   ├── fileUtils.ts\n    │   ├── stackTraceParser.ts\n    │   └── types.ts\n└── tsconfig.json\n\n```\n\n## Dependencies\n\n### Production Dependencies\n- @ast-grep/cli: ^0.33.1\n- axios: ^1.7.9\n- chalk: ^5.4.1\n- commander: ^11.1.0\n- glob: ^11.0.1\n- inquirer: ^9.3.7\n\n### Development Dependencies\n- @types/glob: ^8.1.0\n- @types/inquirer: ^9.0.7\n- @types/node: ^20.17.12\n- ts-node: ^10.9.2\n- typescript: ^5.7.3\n\n",
    "timestamp": "2025-01-19T19:27:55.201Z"
  },
  "prompt": "Please analyze the code and error log, and explain what might be wrong."
}